{
  "$schema": "https://json-schema.org/draft/2020-12/schema",
  "$id": "schemas/sae_checkpoint/v1.schema.json",
  "title": "sae_checkpoint v1 (A5)",
  "type": "object",
  "additionalProperties": false,
  "required": ["artifact_type", "schema_version", "self_hash", "created_at", "created_by", "subject", "payload"],
  "properties": {
    "artifact_type": { "const": "sae_checkpoint" },
    "schema_version": { "const": 1 },
    "self_hash": { "type": "string", "pattern": "^sha256:[0-9a-f]{64}$" },
    "created_at": { "type": "string", "format": "date-time" },
    "created_by": {
      "type": "object",
      "additionalProperties": false,
      "required": ["run_id", "code_commit", "entrypoint", "host"],
      "properties": {
        "run_id": { "type": "string" },
        "code_commit": { "type": "string" },
        "entrypoint": { "type": "string" },
        "host": { "type": "string" }
      }
    },
    "subject": {
      "type": "array",
      "items": {
        "type": "object",
        "additionalProperties": false,
        "required": ["content_hash", "location", "role"],
        "properties": {
          "content_hash": { "type": "string", "pattern": "^sha256:[0-9a-f]{64}$" },
          "location": { "type": "string", "pattern": "^(tamia|local|hf|wandb):.+$" },
          "role": { "type": "string" }
        }
      }
    },
    "payload": {
      "type": "object",
      "additionalProperties": false,
      "required": [
        "config", "store_hash", "seed", "tokens_trained", "wandb", "telemetry_tail",
        "training_provenance", "cfg_schema_generation"
      ],
      "properties": {
        "config": {
          "type": "object",
          "description": "the exact SAELens config that ran, serialized verbatim -- opaque here, never reconstructed from YAML"
        },
        "cfg_schema_generation": {
          "description": "ED-33: which SAELens cfg.json schema generation this checkpoint's `config` was written in -- the identity-bearing structural fact (ED-27's logic, one level out) that determines which library version can load it, independent of any free-text version string. null iff genuinely undeterminable from available evidence.",
          "enum": ["3.x", "6.x", null]
        },
        "training_provenance": {
          "description": "ED-33: the SAE-stack library versions that actually trained this checkpoint, recorded distinctly from any resave/handling library (never blended, per ED-30's value-plus-provenance doctrine). Required-present with nullable sub-values -- an unrecoverable legacy checkpoint carries {sae_lens: null, ..., source: \"unknown\", confidence: \"unknown\"} rather than omitting the field (ED-9: null = no instrument, not zero).",
          "type": "object",
          "additionalProperties": false,
          "required": ["sae_lens", "transformers", "transformer_lens", "source", "confidence"],
          "properties": {
            "sae_lens": { "type": ["string", "null"] },
            "transformers": { "type": ["string", "null"] },
            "transformer_lens": { "type": ["string", "null"] },
            "source": { "enum": ["cfg_metadata", "runner_cfg", "wandb", "inferred", "unknown"] },
            "confidence": { "enum": ["measured", "inferred", "unknown"] }
          }
        },
        "store_hash": {
          "description": "ED-5: null only for legacy checkpoints trained via SAELens streaming before stores existed; the training corpus is then documented by payload.config.dataset_path plus a corpus_manifest reference in `subject`.",
          "type": ["string", "null"],
          "pattern": "^sha256:[0-9a-f]{64}$"
        },
        "seed": { "type": "integer" },
        "tokens_trained": { "type": "integer", "minimum": 0 },
        "wandb": { "type": ["string", "null"] },
        "telemetry_tail": {
          "description": "ED-30: recovered training-run telemetry, never a certified metric -- the only FVU any claim, band evaluation, gate, or report may consume is A6 metrics.fvu. fvu_source records provenance; null iff fvu is unrecoverable from legacy data. dead_count follows the same nullability doctrine (ED-9: zero is a measurement, null is the absence of an instrument).",
          "type": "object",
          "additionalProperties": false,
          "required": ["fvu", "fvu_source", "dead_count"],
          "properties": {
            "fvu": { "type": ["number", "null"] },
            "fvu_source": { "enum": ["training_eval", "training_step", null] },
            "dead_count": { "type": ["integer", "null"], "minimum": 0 }
          },
          "allOf": [
            {
              "if": { "properties": { "fvu_source": { "const": null } } },
              "then": { "properties": { "fvu": { "const": null } } }
            },
            {
              "if": { "properties": { "fvu_source": { "enum": ["training_eval", "training_step"] } } },
              "then": { "properties": { "fvu": { "type": "number" } }, "required": ["fvu"] }
            }
          ]
        }
      }
    }
  }
}
