{
  "artifact_type": "sae_checkpoint",
  "created_at": "2026-07-25T23:17:00Z",
  "created_by": {
    "code_commit": "1d54b5256a8bf05951f3a44c635a729026f5930a",
    "entrypoint": "interplab.jobs.backfill_checkpoint",
    "host": "tamia",
    "run_id": "r20260725-2317-28d1"
  },
  "payload": {
    "cfg_schema_generation": "6.x",
    "config": {
      "act_store_device": "cuda",
      "activations_mixing_fraction": 0.5,
      "adam_beta1": 0.9,
      "adam_beta2": 0.999,
      "autocast": false,
      "autocast_lm": false,
      "cached_activations_path": null,
      "checkpoint_path": "results/sae_checkpoints/d1bgp5v5",
      "compile_llm": false,
      "compile_sae": false,
      "context_size": 512,
      "dataset_path": "/scratch/y/yazid/hf_cache/fineweb_subset",
      "dataset_trust_remote_code": true,
      "dead_feature_threshold": "1e-08",
      "dead_feature_window": 1000,
      "device": "cuda",
      "disable_concat_sequences": false,
      "dtype": "bfloat16",
      "eval_batch_size_prompts": 4,
      "exclude_special_tokens": false,
      "feature_sampling_window": 2000,
      "from_pretrained_path": null,
      "hook_eval": "NOT_IN_USE",
      "hook_head_index": null,
      "hook_name": "blocks.16.hook_resid_post",
      "is_dataset_tokenized": false,
      "llm_compilation_mode": null,
      "llm_device": "cuda",
      "logger": {
        "eval_every_n_wandb_logs": 10,
        "log_activations_store_to_wandb": false,
        "log_optimizer_state_to_wandb": false,
        "log_to_wandb": true,
        "log_weights_to_wandb": false,
        "run_name": "topk-163840-LR-0.0002-Tokens-4.000e+08",
        "wandb_entity": null,
        "wandb_id": null,
        "wandb_log_frequency": 100,
        "wandb_project": "qwen-sae-interp"
      },
      "lr": 0.0002,
      "lr_decay_steps": 5000,
      "lr_end": "2e-05",
      "lr_scheduler_name": "cosineannealing",
      "lr_warm_up_steps": 1000,
      "model_class_name": "HookedTransformer",
      "model_from_pretrained_kwargs": {
        "cache_dir": "/scratch/y/yazid/hf_cache",
        "dtype": "bfloat16"
      },
      "model_kwargs": {},
      "model_name": "Qwen/Qwen2.5-14B-Instruct",
      "n_batches_for_norm_estimate": 1000,
      "n_batches_in_buffer": 20,
      "n_checkpoints": 8,
      "n_eval_batches": 10,
      "n_restart_cycles": 1,
      "output_path": null,
      "prefetch_llm_batches": false,
      "prepend_bos": true,
      "resume_from_checkpoint": null,
      "sae": {
        "apply_b_dec_to_input": false,
        "architecture": "topk",
        "aux_loss_coefficient": 1.0,
        "d_in": 5120,
        "d_sae": 163840,
        "decoder_init_norm": 0.1,
        "device": "cpu",
        "dtype": "bfloat16",
        "k": 100,
        "metadata": {
          "sae_lens_training_version": "6.44.2",
          "sae_lens_version": "6.44.2"
        },
        "normalize_activations": "none",
        "rescale_acts_by_decoder_norm": true,
        "reshape_activations": "none",
        "use_sparse_activations": false
      },
      "sae_compilation_mode": null,
      "sae_lens_training_version": "6.44.2",
      "sae_lens_version": "6.44.2",
      "save_final_checkpoint": true,
      "seed": 42,
      "seqpos_slice": [
        null
      ],
      "sequence_separator_token": "bos",
      "store_batch_size_prompts": 8,
      "streaming": true,
      "train_batch_size_tokens": 2048,
      "training_tokens": 400000000,
      "use_cached_activations": false,
      "use_chat_formatting": false,
      "verbose": true
    },
    "seed": 42,
    "store_hash": null,
    "telemetry_tail": {
      "dead_count": 492,
      "fvu": 0.0234375,
      "fvu_source": "training_step"
    },
    "tokens_trained": 400001024,
    "training_provenance": {
      "confidence": "measured",
      "sae_lens": "6.44.2",
      "source": "wandb",
      "transformer_lens": "3.4.0",
      "transformers": "5.12.1"
    },
    "wandb": "wandb:hstg7843"
  },
  "schema_version": 1,
  "self_hash": "sha256:09e7d4744cfa5fa4aeece0eb2aedc200a7ef889433ad477d14e9511582029665",
  "subject": [
    {
      "content_hash": "sha256:4f9e6970aeaa95d27ac9e5381aecd2cb323a300beb094c7cebec103f05ef6632",
      "location": "tamia:sae_checkpoints/d1bgp5v5/final_400001024",
      "role": "weights"
    },
    {
      "content_hash": "sha256:8048b369f0a53642341b175c619db5996d69381599d4029938aafd92d2ab31ce",
      "location": "hf:Qwen/Qwen2.5-14B-Instruct@cf98f3b3bbb457ad9e2bb7baf9a0125b6b88caa8",
      "role": "model"
    },
    {
      "content_hash": "sha256:88740b7463610b932917b5a0b0ebe81959cd4170cffe6b36fa229b0df64239dc",
      "location": "local:registry/corpus_manifest/88740b746361.json",
      "role": "corpus_manifest"
    }
  ]
}
